<?xml version="1.0" encoding="UTF-8"?>
<tns:product xmlns:tns="http://www.example.org/MainProductSchema" xmlns:xsi="http://www.w3.org/2001/XMLSchema-instance" xsi:schemaLocation="http://www.example.org/MainProductSchema MainProductSchema.xsd ">
  <name>name</name>
  <provider>provider</provider>
  <supplier>supplier</supplier>
  <product-supplier-id>product-supplier-id</product-supplier-id>
  <description>description</description>
  <group/>
  <price>price</price>
  <image>http://tempuri.org</image>
</tns:product>
